{
  "schema_version": 3,
  "kind": "environment-provisional",
  "status": "deployed_not_ready",
  "request_sha256": "322c82b214f8f779577f9fc52c2e9d591ff9abf686f1755cd84453ff4884c470",
  "deployment_id": "perf-20261101-a-d1",
  "environment_id": "perf-20261101-a",
  "created_at": "2026-11-01T01:10:00Z",
  "infra": {
    "repository": "soma-376/infra",
    "commit": "f6509b626be2d3ccac752616cd9132d8c49b1e26",
    "profile": "profiles/perf/fixed-v1.json",
    "profile_sha256": "d7b0979fa179384e16bbdc22705deeb09534a3a81f2dc0daabf1d7987bf84459",
    "parameters": {
      "environmentId": "perf-20261101-a",
      "natGateways": 1,
      "mskBrokerVolumeGiB": 100,
      "clickhouseVolumeGiB": 100
    }
  },
  "aws": {
    "region": "ap-northeast-2",
    "account_ref": "perf-account",
    "stacks": [
      {
        "name": "soma-376-perf-network",
        "arn": "arn:aws:cloudformation:ap-northeast-2:111122223333:stack/soma-376-perf-network/0d5e7a10-1b2c-4d3e-8f90-a1b2c3d4e5f6"
      },
      {
        "name": "soma-376-perf-data",
        "arn": "arn:aws:cloudformation:ap-northeast-2:111122223333:stack/soma-376-perf-data/0d5e7a10-1b2c-4d3e-8f90-a1b2c3d4e5f6"
      },
      {
        "name": "soma-376-perf-eks",
        "arn": "arn:aws:cloudformation:ap-northeast-2:111122223333:stack/soma-376-perf-eks/0d5e7a10-1b2c-4d3e-8f90-a1b2c3d4e5f6"
      }
    ]
  },
  "kubernetes": {
    "cluster_arn": "arn:aws:eks:ap-northeast-2:111122223333:cluster/soma-376-perf-eks",
    "cluster_name": "soma-376-perf-eks",
    "namespaces": {
      "app": "pulsemetry-perf",
      "observability": "pulsemetry-observability",
      "runner": "pulsemetry-perf-runner"
    }
  },
  "endpoints": {
    "gateway": "http://telemetry-gateway.pulsemetry-perf.svc:8082",
    "enrollment": "http://enrollment-api.pulsemetry-perf.svc:8080",
    "clickhouse_http": "http://clickhouse.pulsemetry-perf.svc:8123",
    "prometheus_remote_write": "http://pulsemetry-monitoring-prometheus.pulsemetry-observability.svc:9090/api/v1/write"
  },
  "lock": {
    "namespace": "pulsemetry-perf-runner",
    "configmap_name": "perf-run-lock"
  },
  "cleanup_inventory": [
    {
      "resource_type": "AWS::CloudFormation::Stack",
      "identifier": "arn:aws:cloudformation:ap-northeast-2:111122223333:stack/soma-376-perf-network/0d5e7a10-1b2c-4d3e-8f90-a1b2c3d4e5f6",
      "owner_tag": "pulsemetry:perf-environment=perf-20261101-a",
      "retain": false,
      "reason": null
    },
    {
      "resource_type": "AWS::CloudFormation::Stack",
      "identifier": "arn:aws:cloudformation:ap-northeast-2:111122223333:stack/soma-376-perf-data/0d5e7a10-1b2c-4d3e-8f90-a1b2c3d4e5f6",
      "owner_tag": "pulsemetry:perf-environment=perf-20261101-a",
      "retain": false,
      "reason": null
    },
    {
      "resource_type": "AWS::CloudFormation::Stack",
      "identifier": "arn:aws:cloudformation:ap-northeast-2:111122223333:stack/soma-376-perf-eks/0d5e7a10-1b2c-4d3e-8f90-a1b2c3d4e5f6",
      "owner_tag": "pulsemetry:perf-environment=perf-20261101-a",
      "retain": false,
      "reason": null
    },
    {
      "resource_type": "AWS::S3::Bucket",
      "identifier": "arn:aws:s3:::soma-376-perf-evidence",
      "owner_tag": "pulsemetry:perf-evidence",
      "retain": true,
      "reason": "실행 증거 90일 보존. 환경 삭제와 수명을 분리한다"
    }
  ],
  "errors": []
}
